{
  "level": "attention",
  "items": [
    {
      "kind": "pr_open",
      "ticket": "KO-10",
      "ticket_url": null,
      "title": "Reviewed ticket",
      "run": 4,
      "pr_url": "https://github.com/example/repo/pull/10",
      "park_kind": "pull_request",
      "reason": "",
      "asked_ms": 1749999970000,
      "pr": {
        "number": 10,
        "checks": null,
        "review": null,
        "threads": null,
        "open_threads": null,
        "title": null,
        "state": null,
        "additions": null,
        "deletions": null,
        "changed_files": null,
        "preview_url": null,
        "screenshots": [],
        "videos": []
      },
      "round": 0,
      "waits_on": [],
      "level": "attention"
    }
  ],
  "now": 1750000000000,
  "project": "/repo"
}
